{
  "schema_version": "1.0.0",
  "graph_id": "electromagnetism_university",
  "version": "0.1.0",
  "status": "draft",
  "created_at": "2026-10-22T17:00:31Z",
  "course": {
    "id": "university_electromagnetism",
    "name": "大学电磁学",
    "language": "zh-CN"
  },
  "chapters": [
    {
      "id": "ch_electrostatics",
      "title": "静电场",
      "parent_id": null,
      "order": 0
    },
    {
      "id": "ch_electrostatics_s1",
      "title": "1.1 电荷与库仑定律",
      "parent_id": "ch_electrostatics",
      "order": 0
    },
    {
      "id": "ch_electrostatics_s2",
      "title": "1.2 电场强度",
      "parent_id": "ch_electrostatics",
      "order": 1
    },
    {
      "id": "ch_electrostatics_s3",
      "title": "1.3 电通量",
      "parent_id": "ch_electrostatics",
      "order": 2
    },
    {
      "id": "ch_electrostatics_s4",
      "title": "1.4 高斯定理",
      "parent_id": "ch_electrostatics",
      "order": 3
    },
    {
      "id": "ch_electrostatics_s5",
      "title": "1.5 高斯面法",
      "parent_id": "ch_electrostatics",
      "order": 4
    },
    {
      "id": "ch_electrostatics_s6",
      "title": "1.6 典型应用",
      "parent_id": "ch_electrostatics",
      "order": 5
    },
    {
      "id": "ch_electrostatics_s7",
      "title": "1.7 静电屏蔽",
      "parent_id": "ch_electrostatics",
      "order": 6
    },
    {
      "id": "ch_steady_magnetic_field",
      "title": "恒定磁场",
      "parent_id": null,
      "order": 1
    },
    {
      "id": "ch_steady_magnetic_field_s1",
      "title": "2.1 磁感应强度",
      "parent_id": "ch_steady_magnetic_field",
      "order": 0
    },
    {
      "id": "ch_steady_magnetic_field_s2",
      "title": "2.2 磁通量",
      "parent_id": "ch_steady_magnetic_field",
      "order": 1
    },
    {
      "id": "ch_steady_magnetic_field_s3",
      "title": "2.3 安培环路定理",
      "parent_id": "ch_steady_magnetic_field",
      "order": 2
    },
    {
      "id": "ch_electromagnetic_induction",
      "title": "电磁感应",
      "parent_id": null,
      "order": 2
    },
    {
      "id": "ch_electromagnetic_induction_s1",
      "title": "3.1 法拉第电磁感应定律",
      "parent_id": "ch_electromagnetic_induction",
      "order": 0
    },
    {
      "id": "ch_electromagnetic_induction_s2",
      "title": "3.2 麦克斯韦方程组",
      "parent_id": "ch_electromagnetic_induction",
      "order": 1
    }
  ],
  "sources": [
    {
      "id": "src_textbook",
      "title": "sample_electromagnetism",
      "edition": "未注明",
      "source_type": "markdown",
      "uri": "asset://kg-constructor/sample_electromagnetism.md",
      "sha256": "0c2e27fecb491fb35489639233cf1b26f9ff79ee7bcf732d6886f36aad9b7d10"
    }
  ],
  "evidence": [
    {
      "id": "ev_0001",
      "source_id": "src_textbook",
      "locator": {
        "section": "静电场 / 1.1 电荷与库仑定律",
        "page_start": null,
        "page_end": null,
        "anchor": "sec_001_kp_001"
      },
      "quote": "库仑定律指出，真空中两个静止点电荷之间的相互作用力与它们电荷量的乘积成正比，与它们距离的平方成反比。",
      "rag_ref": null
    },
    {
      "id": "ev_0002",
      "source_id": "src_textbook",
      "locator": {
        "section": "静电场 / 1.1 电荷与库仑定律",
        "page_start": null,
        "page_end": null,
        "anchor": "sec_001_kp_002"
      },
      "quote": "$$F = k \\frac{q_1 q_2}{r^2}$$",
      "rag_ref": null
    },
    {
      "id": "ev_0003",
      "source_id": "src_textbook",
      "locator": {
        "section": "静电场 / 1.1 电荷与库仑定律",
        "page_start": null,
        "page_end": null,
        "anchor": "sec_001_kp_003"
      },
      "quote": "电荷是物体的一种基本属性，同种电荷相互排斥，异种电荷相互吸引。",
      "rag_ref": null
    },
    {
      "id": "ev_0004",
      "source_id": "src_textbook",
      "locator": {
        "section": "静电场 / 1.1 电荷与库仑定律",
        "page_start": null,
        "page_end": null,
        "anchor": "sec_001_kp_004"
      },
      "quote": "点电荷是理想化的带电体模型，当带电体的形状和大小对研究问题的影响可以忽略时，可以把它看作点电荷。",
      "rag_ref": null
    },
    {
      "id": "ev_0005",
      "source_id": "src_textbook",
      "locator": {
        "section": "静电场 / 1.1 电荷与库仑定律",
        "page_start": null,
        "page_end": null,
        "anchor": "sec_001_kp_005"
      },
      "quote": "库仑定律指出，真空中两个静止点电荷之间的相互作用力与它们电荷量的乘积成正比，与它们距离的平方成反比。",
      "rag_ref": null
    },
    {
      "id": "ev_0006",
      "source_id": "src_textbook",
      "locator": {
        "section": "静电场 / 1.2 电场强度",
        "page_start": null,
        "page_end": null,
        "anchor": "sec_002_kp_006"
      },
      "quote": "$$E = \\frac{F}{q}$$",
      "rag_ref": null
    },
    {
      "id": "ev_0007",
      "source_id": "src_textbook",
      "locator": {
        "section": "静电场 / 1.2 电场强度",
        "page_start": null,
        "page_end": null,
        "anchor": "sec_002_kp_007"
      },
      "quote": "电场强度定义为置于电场中某点的试探电荷所受电场力与其电荷量之比，即\n\n \n\n电场强度是矢量，方向与正电荷在该点所受电场力的方向相同。",
      "rag_ref": null
    },
    {
      "id": "ev_0008",
      "source_id": "src_textbook",
      "locator": {
        "section": "静电场 / 1.2 电场强度",
        "page_start": null,
        "page_end": null,
        "anchor": "sec_002_kp_008"
      },
      "quote": "电场强度定义为置于电场中某点的试探电荷所受电场力与其电荷量之比，即\n\n \n\n电场强度是矢量，方向与正电荷在该点所受电场力的方向相同。",
      "rag_ref": null
    },
    {
      "id": "ev_0009",
      "source_id": "src_textbook",
      "locator": {
        "section": "静电场 / 1.2 电场强度",
        "page_start": null,
        "page_end": null,
        "anchor": "sec_002_kp_009"
      },
      "quote": "电场强度定义为置于电场中某点的试探电荷所受电场力与其电荷量之比，即\n\n \n\n电场强度是矢量，方向与正电荷在该点所受电场力的方向相同。",
      "rag_ref": null
    },
    {
      "id": "ev_0010",
      "source_id": "src_textbook",
      "locator": {
        "section": "静电场 / 1.2 电场强度",
        "page_start": null,
        "page_end": null,
        "anchor": "sec_002_kp_010"
      },
      "quote": "电场线是为了直观描述电场而引入的假想曲线，电场线的疏密表示电场强度的大小。",
      "rag_ref": null
    },
    {
      "id": "ev_0011",
      "source_id": "src_textbook",
      "locator": {
        "section": "静电场 / 1.3 电通量",
        "page_start": null,
        "page_end": null,
        "anchor": "sec_003_kp_011"
      },
      "quote": "$$\\Phi_E = E S \\cos\\theta$$",
      "rag_ref": null
    },
    {
      "id": "ev_0012",
      "source_id": "src_textbook",
      "locator": {
        "section": "静电场 / 1.3 电通量",
        "page_start": null,
        "page_end": null,
        "anchor": "sec_003_kp_012"
      },
      "quote": "电通量定义为电场强度对某一有向曲面的面积分。",
      "rag_ref": null
    },
    {
      "id": "ev_0013",
      "source_id": "src_textbook",
      "locator": {
        "section": "静电场 / 1.4 高斯定理",
        "page_start": null,
        "page_end": null,
        "anchor": "sec_004_kp_013"
      },
      "quote": "高斯定理指出，通过任意闭合曲面的电通量，等于该曲面所包围的净电荷量除以真空介电常数。",
      "rag_ref": null
    },
    {
      "id": "ev_0014",
      "source_id": "src_textbook",
      "locator": {
        "section": "静电场 / 1.4 高斯定理",
        "page_start": null,
        "page_end": null,
        "anchor": "sec_004_kp_014"
      },
      "quote": "$$\\oint_S \\mathbf{E} \\cdot d\\mathbf{S} = \\frac{Q_{\\mathrm{enc}}}{\\varepsilon_0}$$",
      "rag_ref": null
    },
    {
      "id": "ev_0015",
      "source_id": "src_textbook",
      "locator": {
        "section": "静电场 / 1.5 高斯面法",
        "page_start": null,
        "page_end": null,
        "anchor": "sec_005_kp_015"
      },
      "quote": "高斯面法是一种利用高斯定理求解对称电场分布的解题方法。",
      "rag_ref": null
    },
    {
      "id": "ev_0016",
      "source_id": "src_textbook",
      "locator": {
        "section": "静电场 / 1.5 高斯面法",
        "page_start": null,
        "page_end": null,
        "anchor": "sec_005_kp_016"
      },
      "quote": "高斯面法是一种利用高斯定理求解对称电场分布的解题方法。",
      "rag_ref": null
    },
    {
      "id": "ev_0017",
      "source_id": "src_textbook",
      "locator": {
        "section": "静电场 / 1.6 典型应用",
        "page_start": null,
        "page_end": null,
        "anchor": "sec_006_kp_017"
      },
      "quote": "均匀带电球面的电场具有球对称性。",
      "rag_ref": null
    },
    {
      "id": "ev_0018",
      "source_id": "src_textbook",
      "locator": {
        "section": "静电场 / 1.6 典型应用",
        "page_start": null,
        "page_end": null,
        "anchor": "sec_006_kp_018"
      },
      "quote": "无限长带电直线的电场具有柱对称性，无限大带电平面的电场具有平面对称性。",
      "rag_ref": null
    },
    {
      "id": "ev_0019",
      "source_id": "src_textbook",
      "locator": {
        "section": "静电场 / 1.6 典型应用",
        "page_start": null,
        "page_end": null,
        "anchor": "sec_006_kp_019"
      },
      "quote": "无限长带电直线的电场具有柱对称性，无限大带电平面的电场具有平面对称性。",
      "rag_ref": null
    },
    {
      "id": "ev_0020",
      "source_id": "src_textbook",
      "locator": {
        "section": "静电场 / 1.7 静电屏蔽",
        "page_start": null,
        "page_end": null,
        "anchor": "sec_007_kp_020"
      },
      "quote": "处于静电平衡的导体内部电场为零，外部电场不能穿透导体空腔，这种现象称为静电屏蔽。",
      "rag_ref": null
    },
    {
      "id": "ev_0021",
      "source_id": "src_textbook",
      "locator": {
        "section": "恒定磁场 / 2.1 磁感应强度",
        "page_start": null,
        "page_end": null,
        "anchor": "sec_008_kp_021"
      },
      "quote": "磁感应强度是描述磁场对运动电荷作用力的矢量物理量，常用符号 B 表示。",
      "rag_ref": null
    },
    {
      "id": "ev_0022",
      "source_id": "src_textbook",
      "locator": {
        "section": "恒定磁场 / 2.1 磁感应强度",
        "page_start": null,
        "page_end": null,
        "anchor": "sec_008_kp_022"
      },
      "quote": "磁场对运动电荷的作用力称为洛伦兹力。",
      "rag_ref": null
    },
    {
      "id": "ev_0023",
      "source_id": "src_textbook",
      "locator": {
        "section": "恒定磁场 / 2.2 磁通量",
        "page_start": null,
        "page_end": null,
        "anchor": "sec_009_kp_023"
      },
      "quote": "$$\\Phi_B = \\int_S \\mathbf{B} \\cdot d\\mathbf{S}$$",
      "rag_ref": null
    },
    {
      "id": "ev_0024",
      "source_id": "src_textbook",
      "locator": {
        "section": "恒定磁场 / 2.2 磁通量",
        "page_start": null,
        "page_end": null,
        "anchor": "sec_009_kp_024"
      },